{
  "$schema": "https://json-schema.org/draft/2020-12/schema",
  "$id": "https://ipermit.dev/schemas/2026-05-24/permit-explanation.schema.json",
  "title": "iPermit Permit Explanation Record",
  "description": "Structured explanation emitted alongside each fired (or short-circuited) permit by the deterministic rules engine. See docs/specs/explainability.md (T00-05). Defers rule object field shapes to T00-01, ruleset versioning to T00-03, and engine implementation to T03-05.",
  "type": "object",
  "additionalProperties": false,
  "required": [
    "schema_version",
    "record_kind",
    "evaluation_date",
    "ruleset_version",
    "rule_refs",
    "jurisdiction_chain",
    "evaluation_trace",
    "confidence",
    "advisories",
    "reproducibility"
  ],
  "properties": {
    "schema_version": {
      "type": "string",
      "const": "1.0.0",
      "description": "Version of this explanation record schema. Distinct from ruleset_version."
    },
    "record_kind": {
      "enum": ["fired", "not_fired"],
      "description": "fired = the rule triggered and a permit is in the matrix. not_fired = a negative explanation (T00-05 §5)."
    },
    "evaluation_date": {
      "type": "string",
      "format": "date",
      "description": "Date the engine evaluated this project. Used by T00-03 to select effective ruleset."
    },
    "ruleset_version": {
      "type": "object",
      "additionalProperties": false,
      "required": ["content_hash"],
      "properties": {
        "content_hash": {
          "type": "string",
          "pattern": "^sha256:[0-9a-f]{64}$",
          "description": "Hash of the effective ruleset snapshot used. Algorithm and snapshotting owned by T00-03."
        },
        "commit_sha": {
          "type": "string",
          "pattern": "^[0-9a-f]{7,40}$",
          "description": "Git commit SHA of the rules repository if the snapshot maps to one. Optional."
        },
        "snapshot_label": {
          "type": "string",
          "description": "Human-readable label for the snapshot (e.g. 2026-05-24-effective)."
        }
      }
    },
    "rule_refs": {
      "type": "array",
      "minItems": 1,
      "uniqueItems": true,
      "description": "The rule(s) this record explains. Multiple entries only when a single permit output is the consensus of overlapping rules (e.g. county + state).",
      "items": {
        "type": "object",
        "additionalProperties": false,
        "required": ["rule_id", "rule_version"],
        "properties": {
          "rule_id": {
            "type": "string",
            "pattern": "^[a-z][a-z0-9]*(-[a-z0-9]+)+$"
          },
          "rule_version": {
            "type": "string",
            "pattern": "^\\d+\\.\\d+\\.\\d+$"
          },
          "rule_status_at_evaluation": {
            "enum": ["effective", "archived"],
            "description": "Status of the rule object at evaluation_date. archived is only valid for grandfathered replays (T00-03)."
          }
        }
      }
    },
    "jurisdiction_chain": {
      "type": "array",
      "minItems": 1,
      "description": "Ordered jurisdictions from Federal down to the most specific applicable jurisdiction, per AGENTS.md hierarchy. The rule's own jurisdiction MUST appear in this chain.",
      "items": {
        "type": "object",
        "additionalProperties": false,
        "required": ["jurisdiction_id", "jurisdiction_level"],
        "properties": {
          "jurisdiction_id": { "type": "string", "minLength": 1 },
          "jurisdiction_level": {
            "enum": [
              "federal",
              "state",
              "county",
              "municipality",
              "etj",
              "utility_district",
              "drainage_district",
              "river_authority",
              "special"
            ]
          },
          "canonical_name": { "type": "string", "minLength": 1 },
          "detection_source": {
            "enum": ["user_input", "gis_auto_detect", "user_confirmed", "user_override"],
            "description": "How this jurisdiction entered the evaluation. See T05-04 / T06-02."
          }
        }
      }
    },
    "trigger_path": {
      "description": "The conditions in the rule's triggers tree that were evaluated, with field paths, operators, and observed values. Required when record_kind = fired; for not_fired, this shows up to the failing leaf.",
      "type": "object",
      "additionalProperties": false,
      "required": ["root"],
      "properties": {
        "root": { "$ref": "#/$defs/evaluatedCondition" },
        "matched_summary": {
          "type": "string",
          "maxLength": 500,
          "description": "Plain-language collapsed restatement of which branches matched. Derived; included for human review."
        }
      }
    },
    "applicable_thresholds": {
      "type": "array",
      "description": "Numeric thresholds that governed the decision, lifted from matching leaves of trigger_path. Empty array when the rule's triggers contained no numeric comparisons.",
      "items": {
        "type": "object",
        "additionalProperties": false,
        "required": ["field", "operator", "threshold_value", "actual_value"],
        "properties": {
          "field": { "type": "string", "pattern": "^(project|geometry|derived)(\\.[a-z][a-z0-9_]*)+$" },
          "operator": {
            "enum": [">", ">=", "<", "<=", "=", "!="]
          },
          "threshold_value": {
            "description": "Threshold from the rule. Number or ISO date string."
          },
          "actual_value": {
            "description": "Observed value from project inputs at evaluation time."
          },
          "units": {
            "type": "string",
            "description": "Units string for human display (e.g. acres, days, count). Optional; the field registry (T02-02) owns canonical units."
          }
        }
      }
    },
    "citations": {
      "type": "array",
      "minItems": 1,
      "description": "Copied verbatim from provenance.source_citations of every rule in rule_refs. Order preserved; duplicates collapsed by reference.",
      "items": {
        "type": "object",
        "additionalProperties": false,
        "required": ["citation_type", "reference"],
        "properties": {
          "citation_type": {
            "enum": ["statute", "regulation", "ordinance", "agency_guidance", "form", "website"]
          },
          "reference": { "type": "string", "minLength": 1 },
          "url": { "type": "string", "format": "uri" },
          "retrieved_at": { "type": "string", "format": "date" }
        }
      }
    },
    "confidence": {
      "type": "object",
      "additionalProperties": false,
      "required": ["tier", "tier_rationale", "freshness"],
      "properties": {
        "tier": {
          "type": "integer",
          "enum": [1, 2, 3],
          "description": "Confidence tier copied from the rule. When multiple rules contribute, this is the LOWEST (most cautious) tier across rule_refs."
        },
        "tier_rationale": {
          "type": "string",
          "minLength": 1,
          "maxLength": 500,
          "description": "Plain-language statement of why this tier applies. Combines AGENTS.md tier definitions with rule-specific context."
        },
        "freshness": {
          "type": "object",
          "additionalProperties": false,
          "required": ["last_verified", "days_since_verified", "stale"],
          "properties": {
            "last_verified": { "type": "string", "format": "date" },
            "days_since_verified": { "type": "integer", "minimum": 0 },
            "stale": {
              "type": "boolean",
              "description": "True when days_since_verified exceeds the freshness threshold owned by T02-07. Surfaced independently of confidence per AGENTS.md Data Governance."
            },
            "stale_reason": {
              "type": "string",
              "description": "Required when stale = true. Human-readable reason (e.g. 'last verified 540 days ago; threshold is 365')."
            }
          }
        }
      }
    },
    "known_unknowns": {
      "type": "array",
      "description": "Stated uncertainties. Union of the rule's known_unknowns and engine-detected uncertainties at evaluation time (e.g. partial GIS overlap, intake field missing).",
      "items": {
        "type": "object",
        "additionalProperties": false,
        "required": ["text", "origin"],
        "properties": {
          "text": { "type": "string", "minLength": 1 },
          "origin": {
            "enum": ["rule", "engine"],
            "description": "rule = copied from rule.known_unknowns. engine = detected at evaluation time."
          },
          "engine_signal": {
            "type": "string",
            "description": "Required when origin = engine. Identifier of the engine signal (e.g. partial_gis_overlap, missing_intake_field, citation_url_unreachable)."
          }
        }
      }
    },
    "advisories": {
      "type": "array",
      "minItems": 1,
      "description": "At least one advisory MUST be present per AGENTS.md Liability Strategy. Union of rule.advisories and any engine-injected disclaimers (e.g. stale freshness, low confidence).",
      "items": {
        "type": "object",
        "additionalProperties": false,
        "required": ["text", "origin", "category"],
        "properties": {
          "text": { "type": "string", "minLength": 1 },
          "origin": {
            "enum": ["rule", "engine", "platform"],
            "description": "platform = the standing advisory required for every permit record (e.g. 'Advisory only; not a legal determination')."
          },
          "category": {
            "enum": [
              "advisory_disclaimer",
              "professional_review_required",
              "agency_coordination",
              "freshness_warning",
              "confidence_warning",
              "jurisdictional_overlap",
              "data_gap"
            ]
          }
        }
      }
    },
    "evaluation_trace": {
      "type": "array",
      "minItems": 6,
      "maxItems": 6,
      "description": "Exactly six entries, one per AGENTS.md evaluation step (T00-01 §8). Order is fixed: jurisdiction, temporal_validity, project_type, trigger_conditions, spatial_overlays, dependencies.",
      "items": {
        "type": "object",
        "additionalProperties": false,
        "required": ["step", "outcome"],
        "properties": {
          "step": {
            "enum": [
              "jurisdiction",
              "temporal_validity",
              "project_type",
              "trigger_conditions",
              "spatial_overlays",
              "dependencies"
            ]
          },
          "outcome": {
            "enum": ["passed", "failed", "skipped"],
            "description": "skipped = an earlier step short-circuited, so this step was not evaluated."
          },
          "detail": {
            "type": "string",
            "description": "One-line explanation of the outcome (e.g. 'rule jurisdiction us-federal in chain', 'project_type substation not in applicable_project_types')."
          }
        }
      }
    },
    "negative_explanation": {
      "description": "Required when record_kind = not_fired. The step that short-circuited and a human-readable reason.",
      "type": "object",
      "additionalProperties": false,
      "required": ["short_circuited_at", "reason"],
      "properties": {
        "short_circuited_at": {
          "enum": [
            "jurisdiction",
            "temporal_validity",
            "project_type",
            "trigger_conditions",
            "spatial_overlays",
            "dependencies"
          ]
        },
        "reason": { "type": "string", "minLength": 1, "maxLength": 500 }
      }
    },
    "reproducibility": {
      "type": "object",
      "additionalProperties": false,
      "required": ["inputs_hash", "deterministic"],
      "properties": {
        "inputs_hash": {
          "type": "string",
          "pattern": "^sha256:[0-9a-f]{64}$",
          "description": "Hash of the canonical project inputs (intake + confirmed GIS) used. Combined with ruleset_version.content_hash and evaluation_date, this triplet keys the reproducibility contract (§6)."
        },
        "deterministic": {
          "type": "boolean",
          "const": true,
          "description": "Asserts the record was produced by the deterministic engine path; no AI-derived fields are present in this record."
        },
        "regeneration_note": {
          "type": "string",
          "description": "Optional note from the engine about reproducibility caveats (e.g. 'GIS dataset version 2026.04 must be available for replay')."
        }
      }
    }
  },

  "allOf": [
    {
      "description": "trigger_path is required when record_kind = fired",
      "if": { "properties": { "record_kind": { "const": "fired" } } },
      "then": { "required": ["trigger_path"] }
    },
    {
      "description": "negative_explanation is required when record_kind = not_fired",
      "if": { "properties": { "record_kind": { "const": "not_fired" } } },
      "then": { "required": ["negative_explanation"] }
    }
  ],

  "$defs": {
    "evaluatedCondition": {
      "oneOf": [
        { "$ref": "#/$defs/evaluatedLeaf" },
        { "$ref": "#/$defs/evaluatedAll" },
        { "$ref": "#/$defs/evaluatedAny" },
        { "$ref": "#/$defs/evaluatedNot" }
      ]
    },
    "evaluatedLeaf": {
      "type": "object",
      "additionalProperties": false,
      "required": ["field", "operator", "matched", "actual_value"],
      "properties": {
        "field": {
          "type": "string",
          "pattern": "^(project|geometry|derived)(\\.[a-z][a-z0-9_]*)+$"
        },
        "operator": {
          "enum": ["=", "!=", ">", ">=", "<", "<=", "contains", "intersects", "exists", "in", "not_in"]
        },
        "expected_value": {
          "description": "Threshold from the rule. Omitted for operator = exists."
        },
        "actual_value": {
          "description": "Observed value at evaluation time. May be null when the field was absent from inputs."
        },
        "matched": { "type": "boolean" },
        "evaluation_notes": {
          "type": "string",
          "description": "Optional engine notes (e.g. 'value coerced from string to number', 'field absent; treated as null')."
        }
      }
    },
    "evaluatedAll": {
      "type": "object",
      "additionalProperties": false,
      "required": ["all", "matched"],
      "properties": {
        "all": {
          "type": "array",
          "minItems": 1,
          "items": { "$ref": "#/$defs/evaluatedCondition" }
        },
        "matched": { "type": "boolean" }
      }
    },
    "evaluatedAny": {
      "type": "object",
      "additionalProperties": false,
      "required": ["any", "matched"],
      "properties": {
        "any": {
          "type": "array",
          "minItems": 1,
          "items": { "$ref": "#/$defs/evaluatedCondition" }
        },
        "matched": { "type": "boolean" }
      }
    },
    "evaluatedNot": {
      "type": "object",
      "additionalProperties": false,
      "required": ["not", "matched"],
      "properties": {
        "not": { "$ref": "#/$defs/evaluatedCondition" },
        "matched": { "type": "boolean" }
      }
    }
  }
}
